2025-06-19 12:16:12.463123 IP 192.168.100.102.39486 > 192.168.100.101.8081: Flags [S], seq 3670574237, win 64240, options [mss 1460,sackOK,TS val 641635910 ecr 0,nop,wscale 7], length 0
2025-06-19 12:16:12.463179 IP 192.168.100.101.8081 > 192.168.100.102.39486: Flags [S.], seq 2210718943, ack 3670574238, win 65160, options [mss 1460,sackOK,TS val 2591898391 ecr 641635910,nop,wscale 7],>
2025-06-19 12:16:12.463208 IP 192.168.100.102.39486 > 192.168.100.101.8081: Flags [.], ack 1, win 502, options [nop,nop,TS val 641635910 ecr 2591898391], length 0
2025-06-19 12:16:12.463833 IP 192.168.100.102.39486 > 192.168.100.101.8081: Flags [P.], seq 1:104, ack 1, win 502, options [nop,nop,TS val 641635910 ecr 2591898391], length 103
2025-06-19 12:16:12.463854 IP 192.168.100.101.8081 > 192.168.100.102.39486: Flags [.], ack 104, win 509, options [nop,nop,TS val 2591898391 ecr 641635910], length 0
2025-06-19 12:16:12.478424 IP 192.168.100.101.8081 > 192.168.100.102.39486: Flags [P.], seq 1:160, ack 104, win 509, options [nop,nop,TS val 2591898406 ecr 641635910], length 159
2025-06-19 12:16:12.478488 IP 192.168.100.102.39486 > 192.168.100.101.8081: Flags [.], ack 160, win 501, options [nop,nop,TS val 641635925 ecr 2591898406], length 0
2025-06-19 12:16:12.479951 IP 192.168.100.102.39486 > 192.168.100.101.8081: Flags [F.], seq 104, ack 160, win 501, options [nop,nop,TS val 641635926 ecr 2591898406], length 0
2025-06-19 12:16:12.491974 IP 192.168.100.101.8081 > 192.168.100.102.39486: Flags [F.], seq 160, ack 105, win 509, options [nop,nop,TS val 2591898419 ecr 641635926], length 0
2025-06-19 12:16:12.492038 IP 192.168.100.102.39486 > 192.168.100.101.8081: Flags [.], ack 161, win 501, options [nop,nop,TS val 641635939 ecr 2591898419], length 0

